[
  {
    "default": "900",
    "description": "Seconds before a project command run by the gate is killed.",
    "docs": "scripts/aegis/aegis_cli/flow.py",
    "id": "AEGIS_COMMAND_TIMEOUT",
    "origin": "LEGACY-v1",
    "required": false,
    "scope": "local",
    "secret": false,
    "status": "active",
    "verified": "confirmed"
  },
  {
    "description": "Set to 1 to print the traceback of an unexpected CLI error.",
    "docs": "scripts/aegis/aegis_cli/__main__.py",
    "example": "1",
    "id": "AEGIS_DEBUG",
    "origin": "LEGACY-v1",
    "required": false,
    "scope": "local",
    "secret": false,
    "status": "active",
    "verified": "confirmed"
  },
  {
    "description": "Repository root the prepared change bundle in .aegis/changes/universal-01 patches; exported by its apply_all.sh. Remove this entry when the bundle is retired.",
    "docs": ".aegis/changes/universal-01/README.md",
    "example": "/path/to/aegis-sdd",
    "id": "AEGIS_PATCH_ROOT",
    "origin": "TASK-UNBLOCK-02",
    "required": true,
    "scope": "local",
    "secret": false,
    "status": "active",
    "verified": "confirmed"
  },
  {
    "description": "A command that reads text on stdin and prints a token count; replaces the built-in estimate.",
    "docs": "README.md",
    "example": "my-tokenizer --count",
    "id": "AEGIS_TOKENIZER",
    "origin": "LEGACY-v1",
    "required": false,
    "scope": "local",
    "secret": false,
    "status": "active",
    "verified": "confirmed"
  },
  {
    "default": "200000",
    "description": "Maximum files detection lists before reporting a truncated walk.",
    "docs": "scripts/aegis/aegis_cli/detect.py",
    "id": "AEGIS_WALK_LIMIT",
    "origin": "LEGACY-v1",
    "required": false,
    "scope": "local",
    "secret": false,
    "status": "active",
    "verified": "confirmed"
  },
  {
    "description": "Set by Claude Code for plugin hooks; locates the framework's bundled assets.",
    "docs": "docs/ARCHITECTURE.md",
    "id": "CLAUDE_PLUGIN_ROOT",
    "origin": "LEGACY-v1",
    "required": false,
    "scope": "runtime",
    "secret": false,
    "status": "active",
    "verified": "confirmed"
  },
  {
    "description": "Set by Claude Code; the project root hooks and the CLI resolve against.",
    "docs": "docs/ARCHITECTURE.md",
    "id": "CLAUDE_PROJECT_DIR",
    "origin": "LEGACY-v1",
    "required": false,
    "scope": "runtime",
    "secret": false,
    "status": "active",
    "verified": "confirmed"
  }
]
